<?xml version="1.0" encoding="UTF-8"?>

<!--
  This file is part of GTI (Generic Tool Infrastructure)

  Copyright (C)
    2008-2019 ZIH, Technische Universitaet Dresden, Federal Republic of Germany
    2008-2019 Lawrence Livermore National Laboratories, United States of America
    2013-2019 RWTH Aachen University, Federal Republic of Germany

  See the LICENSE file in the package base directory for details
-->

<!DOCTYPE layout-specification SYSTEM "/Users/hilbrich/workspace/must/system-builder/dtd/layout-specification.dtd">
<layout-specification>
	<levels>
		<level order="0" size="2" place-name="mpi_app">
        <analyses></analyses>
		</level>
        <level order="1" size="1" place-name="mpi_place">
        <analyses>
            <analysis name="PrintSendRecv" group="HelloWeaver" />
        </analyses>
        </level>
    </levels>
	<communications>
        <default>
            <comm-strategy name="CStratSimpleUp"><settings></settings></comm-strategy>
            <comm-protocol name="CProtMpiSplited"><settings></settings></comm-protocol>
        </default>
        <connection top-level="1" bottom-level="0"></connection>
    </communications>
</layout-specification>
