<?xml version="1.0"?>

<!--
  Part of the MUST Project, under BSD-3-Clause License
 See https://hpc.rwth-aachen.de/must/LICENSE for license information.
  SPDX-License-Identifier: BSD-3-Clause
-->

<!DOCTYPE layout-specification SYSTEM "@MUST_SPECIFICATION_DTD_PATH@/layout-specification.dtd">
<layout-specification>
    <levels>
        <level order="0" size="32" place-name="thread_app">
            <analyses>
            </analyses>
        </level>
        <level order="1" size="8" place-name="thread_place">
            <analyses>
            </analyses>
        </level>
        <level order="2" size="4" place-name="mpi_place">
            <analyses>
            </analyses>
        </level>
        <level order="3" size="1" place-name="mpi_place">
            <analyses>
            </analyses>
        </level>
    </levels>
    <communications>
        <default>
            <comm-strategy name="CStratSimpleUp">
                <settings></settings>
            </comm-strategy>
            <comm-protocol name="CProtMpiSplited">
                <settings></settings>
            </comm-protocol>
        </default>
        <connection top-level="1" bottom-level="0"></connection>
        <connection top-level="2" bottom-level="1"></connection>
        <connection top-level="3" bottom-level="2"></connection>
    </communications>
</layout-specification>
