<?xml version="1.0"?>

<!--
  Part of the MUST Project, under BSD-3-Clause License
 See https://hpc.rwth-aachen.de/must/LICENSE for license information.
  SPDX-License-Identifier: BSD-3-Clause
-->

<!DOCTYPE layout-specification SYSTEM "@MUST_SPECIFICATION_DTD_PATH@/layout-specification.dtd">
<layout-specification>
	<levels>
		<level order="0" size="${numProcsL0}" place-name="mpi_app">
			<analyses>
			    <analysis name="DatatypePredefs" group="MUST_Resource"/>
			    <analysis name="CommPredefs" group="MUST_Resource"/>
			    <analysis name="FinalizeNotify" group="MUST_Base"/>
			    <analysis name="DCollectiveInitNotify" group="MUST_DistributedDeadlock"/>
				${level0ModString}
			</analyses>
		</level>
		<level order="1" size="${numProcsL1}" place-name="mpi_place">
			<analyses>
				${level1ModString}
			</analyses>
		</level>
		<level order="2" size="1" place-name="mpi_place">
			<analyses>
				${level2ModString}	
			</analyses>
		</level></levels>
	<communications>
		<default>
			<comm-strategy name="CStratSimpleUp">
				<settings></settings>
			</comm-strategy>
			<comm-protocol name="CProtMpiSplited">
				<settings></settings>
			</comm-protocol>
		</default>
		<connection top-level="1" bottom-level="0"></connection>
		<connection top-level="2" bottom-level="1"></connection>
	</communications>
</layout-specification>
